{
  "automatic_gates": {
    "deterministic_baseline_tests": {
      "reason": "tests were not executed or repeated under the static protocol",
      "status": "NEEDS_REVIEW"
    },
    "immutable_commit": {
      "reason": "exact commit and Git tree match frozen discovery metadata",
      "status": "PASS"
    },
    "manageable_task_size": {
      "reason": "no repository-level repair task has been constructed",
      "status": "NEEDS_REVIEW"
    },
    "no_proprietary_credentials_or_uncontrolled_service": {
      "reason": "static signals cannot prove absence or necessity of external requirements",
      "status": "NEEDS_REVIEW"
    },
    "reproducible_setup": {
      "reason": "installation was not executed under the static protocol",
      "status": "NEEDS_REVIEW"
    },
    "usable_licence": {
      "reason": "recognized captured SPDX value and at least one licence file",
      "status": "PASS"
    }
  },
  "candidate_id": "CMVP-CAND-0005",
  "facts": {
    "clean_installation": {
      "local_dependency_signal_paths": [],
      "reason": "recognized setup metadata produced at least one command candidate; not executed",
      "status": "APPEARS_FEASIBLE_STATICALLY"
    },
    "database_requirement": {
      "signals": [],
      "status": "NOT_DETECTED_BY_STATIC_SCAN"
    },
    "external_service_requirements": {
      "signals": [
        {
          "path": "README.md",
          "signal": "openai"
        },
        {
          "path": "chatgpt_character.py",
          "signal": "openai"
        },
        {
          "path": "openai_chat.py",
          "signal": "openai"
        },
        {
          "path": "requirements.txt",
          "signal": "openai"
        }
      ],
      "status": "DETECTED_BY_STATIC_SCAN"
    },
    "frozen_commit_resolution": {
      "expected_commit": "725614473a72658057bea184542412577186010f",
      "expected_git_tree_sha": "b4a849917d6c948f19e3ec923e15456146b4a3ad",
      "fetch_succeeded": true,
      "object_error": null,
      "resolved_commit": "725614473a72658057bea184542412577186010f",
      "resolved_git_tree_sha": "b4a849917d6c948f19e3ec923e15456146b4a3ad"
    },
    "gpu_requirement": {
      "signals": [],
      "status": "NOT_DETECTED_BY_STATIC_SCAN"
    },
    "language_runtime_metadata": {
      "captured_primary_language": "Python",
      "declared_runtime_constraints": [],
      "extension_counts": {
        ".bat": 1,
        ".md": 1,
        ".mp3": 1,
        ".py": 7,
        ".sh": 1,
        ".txt": 2,
        ".wav": 1,
        "[no-extension]": 2
      }
    },
    "license": {
      "captured_spdx": "MIT",
      "license_files": [
        {
          "git_blob": "e1b3f1d107fe59b175da5b29113b67f23da375ce",
          "path": "LICENSE",
          "size_bytes": 1071
        }
      ]
    },
    "network_requirement": {
      "signals": [
        {
          "path": "README.md",
          "signal": "https://"
        },
        {
          "path": "azure_speech_to_text.py",
          "signal": "https://"
        },
        {
          "path": "obs_websockets.py",
          "signal": "requests."
        },
        {
          "path": "openai_chat.py",
          "signal": "https://"
        }
      ],
      "status": "DETECTED_BY_STATIC_SCAN"
    },
    "package_build_metadata": {
      "file_evidence": [
        {
          "git_blob": "72ee4daea1c67d10f040918c69f7f69a75f097e9",
          "path": "requirements.txt",
          "size_bytes": 221
        }
      ],
      "paths": [
        "requirements.txt"
      ]
    },
    "proprietary_dependency_requirement": {
      "signals": [
        {
          "path": "README.md",
          "signal": "openai"
        },
        {
          "path": "README.md",
          "signal": "azure"
        },
        {
          "path": "azure_speech_to_text.py",
          "signal": "azure"
        },
        {
          "path": "chatgpt_character.py",
          "signal": "openai"
        },
        {
          "path": "chatgpt_character.py",
          "signal": "azure"
        },
        {
          "path": "openai_chat.py",
          "signal": "openai"
        },
        {
          "path": "requirements.txt",
          "signal": "openai"
        },
        {
          "path": "requirements.txt",
          "signal": "azure"
        }
      ],
      "status": "DETECTED_BY_STATIC_SCAN"
    },
    "repository_size": {
      "bare_depth1_clone_allocated_bytes": 798720,
      "bare_depth1_clone_apparent_bytes": 689720,
      "captured_github_size_kib": 804,
      "logical_tree_blob_bytes": 624389,
      "tree_entry_count": 16,
      "tree_inventory_sha256": "8dad2b25392a4c3d613d07979a14f47f2258b49fe209072d0c19f64648a89a0b"
    },
    "setup_command_candidates": [
      {
        "basis": "requirements.txt",
        "command": "python -m pip install -r requirements.txt"
      }
    ],
    "static_text_scan": {
      "coverage_complete_within_declared_suffixes": true,
      "eligible_file_count": 12,
      "maximum_blob_bytes": 1048576,
      "maximum_total_scanned_blob_bytes": 20971520,
      "scanned_bytes": 50788,
      "scanned_file_count": 12,
      "skipped_binary_paths": [],
      "skipped_budget_paths": [],
      "skipped_oversized_paths": []
    },
    "tests": {
      "cheap_test_count": {
        "class_method_nodes": 0,
        "function_nodes": 0,
        "method": "static_python_ast_name_count",
        "parse_error_paths": [],
        "total": 0
      },
      "detected_frameworks": [],
      "directories": [],
      "files": [],
      "likely_baseline_command": {
        "command": null,
        "reason": "no supported baseline-test framework was statically identified",
        "status": "NEEDS_REVIEW"
      }
    }
  },
  "inspection": {
    "actor_id": "cmvp-stage1-static-inspector-v0.1",
    "candidate_code_executed": false,
    "checkout_created": false,
    "commands": [
      {
        "arguments": [
          "git",
          "init",
          "--bare",
          "/tmp/cmvp-stage1-clones-xxifcrlo/CMVP-CAND-0005.git"
        ],
        "returncode": 0,
        "stderr": "hint: Using 'master' as the name for the initial branch. This default branch name\nhint: is subject to change. To configure the initial branch name to use in all\nhint: of your new repositories, which will suppress this warning, call:\nhint: \nhint: \tgit config --global init.defaultBranch <name>\nhint: \nhint: Names commonly chosen instead of 'master' are 'main', 'trunk' and\nhint: 'development'. The just-created branch can be renamed via this command:\nhint: \nhint: \tgit branch -m <name>\n",
        "stdout": "Initialized empty Git repository in /tmp/cmvp-stage1-clones-xxifcrlo/CMVP-CAND-0005.git/\n",
        "timed_out": false
      },
      {
        "arguments": [
          "git",
          "--git-dir=/tmp/cmvp-stage1-clones-xxifcrlo/CMVP-CAND-0005.git",
          "fetch",
          "--depth=1",
          "--no-tags",
          "https://github.com/DougDougGithub/Babagaboosh.git",
          "725614473a72658057bea184542412577186010f"
        ],
        "returncode": 0,
        "stderr": "From https://github.com/DougDougGithub/Babagaboosh\n * branch            725614473a72658057bea184542412577186010f -> FETCH_HEAD\n",
        "stdout": "",
        "timed_out": false
      }
    ],
    "completed_at_utc": "2026-08-12T17:42:50Z",
    "installation_executed": false,
    "method_commit": "a706f3271b68e6f75326bfe77a733bd09a453289",
    "model_or_treatment_accessed": false,
    "result_path": "benchmark-selection/stage1/v0.1/results/github-python-2024-medium-001/candidates/CMVP-CAND-0005.json",
    "started_at_utc": "2026-08-12T17:42:49Z",
    "temporary_clone_removed_after_batch": true,
    "tests_executed": false
  },
  "p_star_decided": false,
  "protocol_version": "benchmark-selection-v0.1",
  "ranked_or_selected": false,
  "references_constructed": false,
  "repository": {
    "captured_git_tree_sha": "b4a849917d6c948f19e3ec923e15456146b4a3ad",
    "captured_language": "Python",
    "captured_license_spdx": "MIT",
    "default_branch": "main",
    "expected_commit": "725614473a72658057bea184542412577186010f",
    "full_name": "DougDougGithub/Babagaboosh",
    "url": "https://github.com/DougDougGithub/Babagaboosh"
  },
  "resulting_state": "DISCOVERED",
  "schema": "stage1-candidate-result-v0.1",
  "treatment_results_consulted": false,
  "trust_family_assigned": false
}
